"GRN","Title","Value(£)","Start","End",""
"EP/L015099/1","EPSRC Centre for Doctoral Training in Industrial Functional Coatings: COATED2","2,613,845","18-05-2015","31-03-2023","Visualise"
"EP/L016206/1","EPSRC Centre for Doctoral Training in Innovative Metal Processing IMPaCT","3,127,491","01-04-2014","30-09-2022","Visualise"
"EP/L016273/1","EPSRC Centre for Doctoral Training in Advanced Metallic Systems - Challenges in Future Metals Manufacturing","3,485,038","01-04-2014","30-09-2022","Visualise"
"EP/L01680X/1","EPSRC Centre for Doctoral Training in Materials for Demanding Environments","4,291,452","01-05-2014","31-10-2022","Visualise"
"EP/L017466/1","Brunel University - Equipment Account","3,855,000","20-01-2014","19-01-2024","Visualise"
"EP/M022668/1","CCP on Computational Magnetism","203,010","01-05-2015","30-04-2021","Visualise"
"EP/N007239/1","Dislocation based modelling of deformation and fracture in real engineering alloys","668,052","01-11-2015","31-10-2020","Visualise"
"EP/N007638/1","Future Liquid Metal Engineering Hub","10,138,665","01-11-2015","31-10-2022","Visualise"
"EP/N011368/1","Uncovering Fundamental Mechanisms to Enable Sustainable Steel Manufacturing","1,160,080","01-04-2016","31-03-2021","Visualise"
"EP/P003591/1","Linking Microstructure to Neutron Irradiation Defects in Advanced Manufacture of Steels","490,055","01-12-2016","30-11-2020","Visualise"
"EP/P005101/1","Linking Microstructure to Neutron Irradiation Defects in Advanced Manufacture of Steels","665,030","01-12-2016","30-11-2020","Visualise"
"EP/P005640/1","Linking Microstructure to Neutron Irradiation Defects in Advanced Manufacture of Steels","401,198","01-12-2016","30-11-2020","Visualise"
"EP/P006566/1","MAPP: EPSRC Future Manufacturing Hub in Manufacture using Advanced Powder Processes","10,315,413","01-10-2016","30-09-2023","Visualise"
"EP/P01206X/1","ASSURE 2 - Advanced Steel Shaping Using Reduced Energy","752,408","01-01-2017","31-12-2020","Visualise"
"EP/P020755/1","Rapid Product Development through Process Innovation","900,955","20-03-2017","19-09-2021","Visualise"
"EP/P027210/1","Real-time In-line Microstructural Engineering (RIME)","493,728","01-07-2017","31-12-2020","Visualise"
"EP/P027237/1","Real-time In-line Microstructural Engineering (RIME)","511,339","01-07-2017","31-12-2020","Visualise"
"EP/P027318/1","Reactive Metal Jet Fusion Printing","737,247","01-07-2017","31-12-2020","Visualise"
"EP/P029914/1","High Five: Resolution, Sensitivity, in operando Control, Ultra High Vacuum and Ion Sectioning in a Single Instrument","1,802,539","13-09-2017","12-09-2020","Visualise"
"EP/R001715/1","LightForm: Embedding Materials Engineering in Manufacturing with Light Alloys","4,827,337","19-10-2017","18-10-2022","Visualise"
"EP/R002134/1","Reducing the Threat to Public Safety:  Improved metallic object characterisation, location and detection","321,798","01-01-2018","31-12-2020","Visualise"
"EP/R002177/1","Reducing the Threat to Public Safety: Improved metallic object characterisation, location and detection","255,622","01-01-2018","31-12-2020","Visualise"
"EP/R002274/1","Reducing the Threat to Public Safety:  Improved metallic object characterisation, location and detection","71,320","01-01-2018","31-12-2020","Visualise"
"EP/R005974/1","Defect dynamics in energy materials","816,591","01-04-2018","31-03-2023","Visualise"
"EP/R00661X/1","Sir Henry Royce Institute - recurrent grant","31,477,552","01-04-2016","31-03-2021","Visualise"
"EP/R009392/1","Understanding the mechanisms controlling low potential stress corrosion cracking in nuclear reactors","1,412,712","01-12-2017","31-05-2021","Visualise"
"EP/R011001/1","Upscaling environment-friendly cavitation melt treatment (UltraMelt #2)","329,613","01-04-2018","31-08-2021","Visualise"
"EP/R011044/1","Upscaling environment-friendly cavitation melt treatment (UltraMelt2)","261,433","30-03-2018","30-09-2021","Visualise"
"EP/R011095/1","Upscaling environment-friendly cavitation melt treatment (UltraMelt2)","397,618","30-03-2018","30-09-2021","Visualise"
"EP/R011168/1","Investigation on Sustainable Refractory Systems for Investment Casting Manufacturing of Titanium Alloys","450,149","01-01-2018","30-06-2021","Visualise"
"EP/R018863/1","High Reliability Interconnects: New Methodologies for Lead-free Solders","1,299,714","01-07-2018","30-06-2021","Visualise"
"EP/R019207/1","High reliability Interconnects: New Methodologies for Lead-free Solders","105,910","01-07-2018","30-06-2021","Visualise"
"EP/R020140/1","Critical Elements and Materials Network (CrEAM)","297,621","01-05-2018","30-04-2021","Visualise"
"EP/R021694/1","3D in-situ based methodology for optimizing the mechanical performance of selective laser melted aluminium alloys","100,870","01-07-2018","31-08-2020","Visualise"
"EP/R025355/1","FINESSE NanoBio (Fabrication and Imaging of Neon-Etched Structures and Surfaces for Engineering, Nanoscience and Biotechnology)","2,427,240","19-02-2018","30-09-2020","Visualise"
"EP/R025770/1","York: Transforming Research-Oriented Software Engineering","810,261","01-04-2018","31-03-2023","Visualise"
"EP/R027218/1","New Wire Additive Manufacturing (NEWAM)","5,886,209","25-06-2018","24-06-2023","Visualise"
"EP/R029431/1","HIGH END COMPUTING MATERIALS CHEMISTRY CONSORTIUM","489,316","01-11-2018","31-10-2022","Visualise"
"EP/R034478/1","Integrated study of damage after overloads in single crystals","231,090","01-09-2018","31-08-2020","Visualise"
"EP/R041768/1","Renaissance of alloys: nanocrystalline bimetals","223,099","01-04-2018","30-09-2020","Visualise"
"EP/R513544/1","RCUK Catapult Researchers in Residence award (HVM Nuclear AMRC) - Optimisation of Toughness in Electron Beam Welds in Nuclear Pressure Vessel Steels","50,000","06-04-2018","06-09-2020","Visualise"
"EP/S000828/1","From Industry 3.0 to Industry 4.0: Additive Manufacturability","388,202","29-06-2018","01-01-2020","Visualise"
"EP/S005218/1","Prosperity Partnership in Rapid Product Development","2,431,506","01-11-2018","31-10-2023","Visualise"
"EP/S009493/1","Nanomechanical Testing in Controlled Environments and in the TEM (Nano-TCT)","911,357","01-01-2019","31-12-2020","Visualise"
"EP/S013881/1","Nickel Superalloy Design for Corrosion Resistance","741,689","01-09-2019","31-08-2024","Visualise"
"EP/S018107/1","SUSTAIN Manufacturing Hub","10,319,155","01-04-2019","31-03-2026","Visualise"
"EP/S019111/1","UK FIRES: Locating Resource Efficiency at the heart of Future Industrial Strategy in the UK","5,176,328","01-04-2019","31-03-2024","Visualise"
"EP/S019367/1","The Royce: Capitalising on the investment","1,006,681","01-11-2018","31-10-2021","Visualise"
"EP/S021531/1","Correlative Mapping of Crystal Orientation and Chemistry at the Nanoscale","1,385,872","01-07-2019","30-06-2021","Visualise"
"EP/S021663/1","A LEAP 5000 XS for the UK National Atom Probe Facility","2,914,083","01-02-2019","31-01-2021","Visualise"
"EP/S02252X/1","EPSRC Centre for Doctoral Training in Functional Industrial Coatings","4,573,487","01-10-2019","31-03-2028","Visualise"
"EP/S022635/1","EPSRC and SFI Centre for Doctoral Training in Advanced Metallic Systems: Metallurgical Challenges for the Digital Manufacturing Environment","5,434,026","01-10-2019","31-03-2028","Visualise"
"EP/S032169/1","Novel Brazing Filler Metals using High Entropy Alloys","1,092,461","06-01-2020","05-01-2023","Visualise"
"EP/S032819/1","Modelling radiation resistant low activation High Entropy Alloys","337,695","01-12-2019","30-11-2022","Visualise"
"EP/S032835/1","Modelling radiation resistant low activation High Entropy Alloys","22,078","21-10-2019","20-10-2022","Visualise"
"EP/S036296/1","STEP Aluminium","2,249,250","01-03-2019","29-02-2024","Visualise"
"EP/S516089/1","Prosperity Partnership Call 2 Strategic Students-Tata Steel and Swansea University","284,976","01-10-2019","30-09-2023","Visualise"
"EP/T005041/1","Manufacture with Pulsed-Electric Mechano-Vibratory Machining","250,463","01-10-2019","30-09-2021","Visualise"
"EP/T005254/1","New tool - a breakthrough in incremental sheet forming","249,876","01-10-2019","30-09-2021","Visualise"
"EP/T006412/1","Integrated atomic force and confocal fluorescence lifetime imaging microscope with fibre-coupled infrared detector for materials research","817,064","01-12-2019","31-03-2022","Visualise"
"EP/T008687/1","A Moving Cracking Story: Designing against Hydrogen Embrittlement in Titanium","266,043","01-12-2019","28-02-2022","Visualise"
"EP/T009160/1","ENVIRO-COAT: ENVIROnmentally assisted, engineered Corrosion prOducts for Aqueous corrosion miTigation","346,769","01-04-2020","31-03-2023","Visualise"
"EP/T009306/1","An active interface for rapid structural control","249,131","18-05-2020","17-05-2022","Visualise"
"EP/T01041X/1","A Moving Cracking Story: Designing against Hydrogen Embrittlement in Titanium","652,823","01-10-2019","31-12-2021","Visualise"
"EP/T01489X/1","AFM-based nano-machining: developing and validating a novel modelling approach for effective process implementation in nanotechnology applications","692,656","01-01-2020","31-12-2022","Visualise"
"EP/T018518/1","Aerospace casting for the hybrid electric future","937,245","01-05-2020","30-04-2025","Visualise"
"EP/T024054/1","EPSRC Capital Award for Core Equipment - University of Warwick","275,000","17-01-2020","16-07-2021","Visualise"
"EP/T024127/1","TGA/FTIR as a Core Equipment for Delivering Research on Energy System Compound Stability","99,903","12-02-2020","11-08-2021","Visualise"
"EP/T024348/1","Swansea University - Capital Award for Core Equipment","125,000","13-02-2020","12-08-2021","Visualise"
"EP/T024437/1","Multi-User X-ray Diffraction (XRD) Core Equipment","100,000","13-02-2020","12-08-2021","Visualise"
"EP/T024992/1","Doing More With Less: A Digital Twin of state-of-the-art and emerging high value manufacturing routes for high integrity titanium alloy components","2,608,542","01-05-2020","30-04-2024","Visualise"
"EP/T02593X/1","National Research Facility for Lab X-ray CT","10,091,511","01-08-2020","31-07-2025","Visualise"
"EP/T026677/1","Tomographic Imaging: UK Collaborative Computational Projects","296,693","29-08-2020","28-03-2025","Visualise"